{
  "$defs": {
    "LineChange": {
      "description": "Content one line has and another doesn't, or has in another state.",
      "properties": {
        "file": {
          "description": "The file its mark is in, from the project root, as `ascribe check`\nreports it.",
          "type": "string"
        },
        "from_state": {
          "description": "The state in `from`, for a change of state: a lifecycle state, such\nas `preview`, or `ga`.",
          "type": [
            "string",
            "null"
          ]
        },
        "heading": {
          "description": "The heading it's under, or the section's own heading; absent at the\ntop of the page, and for a page.",
          "type": [
            "string",
            "null"
          ]
        },
        "in_place_of": {
          "anyOf": [
            {
              "$ref": "#/$defs/PlaceOf"
            },
            {
              "type": "null"
            }
          ],
          "description": "For a page added, the page `from` has in its place and `to`\ndoesn't, when `replaces` links the two, either way: the pair is one\nchange, so that page isn't listed as removed."
        },
        "kind": {
          "description": "What the mark is on: `page` (the frontmatter's `available`),\n`section` (a heading's), `block` (the block after it), or `row` (a\ntable row's).",
          "type": "string"
        },
        "line": {
          "description": "The mark's line, from 1.",
          "minimum": 0,
          "type": "integer"
        },
        "page": {
          "description": "The page's title, or the file's path when it has none.",
          "type": "string"
        },
        "text": {
          "description": "Its first line, as written.",
          "type": "string"
        },
        "to_state": {
          "description": "The state in `to`, for a change of state.",
          "type": [
            "string",
            "null"
          ]
        }
      },
      "required": [
        "file",
        "line",
        "kind",
        "page",
        "text"
      ],
      "type": "object"
    },
    "PlaceOf": {
      "description": "The page another takes the place of.",
      "properties": {
        "file": {
          "description": "Its file, from the project root.",
          "type": "string"
        },
        "line": {
          "description": "Its mark's line, from 1.",
          "minimum": 0,
          "type": "integer"
        },
        "page": {
          "description": "Its title, or the file's path when it has none.",
          "type": "string"
        }
      },
      "required": [
        "file",
        "line",
        "page"
      ],
      "type": "object"
    }
  },
  "$schema": "https://json-schema.org/draft/2020-12/schema",
  "description": "What differs between two lines of one target.",
  "properties": {
    "added": {
      "description": "What `to` has and `from` doesn't, in page order.",
      "items": {
        "$ref": "#/$defs/LineChange"
      },
      "type": "array"
    },
    "ascribe_version": {
      "description": "The version of Ascribe that wrote it.",
      "type": "string"
    },
    "changed": {
      "description": "What both have, in a different state.",
      "items": {
        "$ref": "#/$defs/LineChange"
      },
      "type": "array"
    },
    "from": {
      "description": "The line compared from, as the list writes it.",
      "type": "string"
    },
    "removed": {
      "description": "What `from` has and `to` doesn't.",
      "items": {
        "$ref": "#/$defs/LineChange"
      },
      "type": "array"
    },
    "schema_version": {
      "description": "The version of this schema. It changes only when a field is removed\nor changes meaning.",
      "minimum": 0,
      "type": "integer"
    },
    "target": {
      "description": "The target.",
      "type": "string"
    },
    "to": {
      "description": "The line compared to.",
      "type": "string"
    }
  },
  "required": [
    "schema_version",
    "ascribe_version",
    "target",
    "from",
    "to",
    "added",
    "removed",
    "changed"
  ],
  "title": "VersionsChangesReport",
  "type": "object"
}
